{
  "handoff_id": "handoff:a0-governed-research-access:3d7ca230:2d885dc4:fdd20eae:528ba4d7:ca0a1bfb:5be7d3e6:48bd2fdf:68d39e45",
  "schema_version": 1,
  "revision": 2,
  "state": "revoked",
  "producer": {
    "batch_id": "A0-governed-research-access",
    "issue": 230,
    "owner": "wangzitian0",
    "head_sha": "10f22e2902682759f4061d83bab1a3a2dc6a30d4"
  },
  "schema_epoch": "truealpha-contracts.governed-research-access.v2",
  "readiness_ceiling": "E2",
  "evidence": [
    {
      "path": "governance/evidence/A0-governed-research-access-E2.v2.json",
      "sha256": "5ddfbe15daceeb3367996447a8441f482c8e444b5ab1fb5c5a76c5fe611af2c4"
    }
  ],
  "allowed_consumers": [
    "C1-stable-mart-reads",
    "C2-typed-mcp-tools",
    "C3-traceable-research-reports",
    "C5-mart-backed-dashboard",
    "C6-deferred-chat",
    "P0-deployed-consumer-validation"
  ],
  "allowed_environments": [
    "ci",
    "local"
  ],
  "retention": "permanent while a named Local/CI consumer depends on this access contract",
  "verification": {
    "reviewer": "github-actions[bot]",
    "evidence_sha256": "4b53626a9d4ebe79825574f7a1d94fbaf360939746cb0c64404464080478a58b",
    "accepted_at": "2026-07-16T08:15:43Z",
    "attestation_ref": "https://github.com/wangzitian0/truealpha/actions/runs/29482629975"
  },
  "revocation": {
    "reason": "Superseded after review invalidated cross-tenant replay isolation, materialized allow grant completeness, and sealed administrator-action persistence",
    "revoked_at": "2026-07-16T09:03:57Z",
    "superseded_by": "handoff:a0-governed-research-access:3d0859d0:25df02f5:3ecbe3e2:b5481c3d:a43f160f:da02eb59:ed595784:87630296"
  }
}
